{
  "sourceId": "22222222-2222-4222-8222-222222222222",
  "revision": 1,
  "connectorVersion": "host-jsonrpc-v1",
  "endpoint": {
    "id": "fixture-host",
    "name": "Fixture Host endpoint",
    "connectorKind": "ZABBIX_HOST",
    "address": "https://192.0.2.10/api_jsonrpc.php",
    "digest": "sha256:d2187c8b693831fd92ae3357626a693c2e5be9b80e457b216200cad8522557ae"
  },
  "credentialPin": {
    "credentialId": "10000000-0000-4000-8000-000000000081",
    "revision": 1,
    "versionId": "10000000-0000-4000-8000-000000000081"
  },
  "connectionDigest": "sha256:fdb7c7af20479d5a48b9dc28017c38c19d2b321c94d77fe075484e318fe86e0e",
  "createdAt": "2026-10-03T00:00:00Z"
}
